code,title,units,prereqs,offered,corrupt
ITALIAN 1,Elementary Italian,5 Units,,"Terms offered: Spring 2018, Fall 2017, Spring 2017<br/>
Basic grammar for beginners: Part one.",0
ITALIAN 1R,Intensive Italian for Romance Languages Speakers,5 Units," Level 4 or higher of a Romance Language (French, Spanish, Portuguese, Romanian or Catalan) or departmental consent on a case by case basis","Terms offered: Spring 2018<br/>
An intensive Italian language course designed for native or advanced speakers of Romance languages (French, Spanish, Portuguese, Romanian, Catalan). In one semester, we will cover materials usually taught in two semesters in Elementary Italian 1 and 2. Students who successfully complete the course will be able to enroll in Italian 3 (Intermediate Italian). Regular attendance is mandatory.",0
ITALIAN 1S,Intensive Italian for Romance Languages Speakers,6 Units," Level 4 or higher of a Romance Language (French, Spanish, Portuguese, Romanian or Catalan) or departmental consent on a case by case basis","Terms offered: Fall 2017, Spring 2017, Fall 2016<br/>
An intensive Italian language course designed for native or advanced speakers of Romance languages (French, Spanish, Portuguese, Romanian, Catalan). In one semester, we will cover materials usually taught in two semesters in Elementary Italian 1 and 2. Students who successfully complete the course will be able to enroll in Italian 3 (Intermediate Italian). Regular and continued attendance of both classes is mandatory.",0
ITALIAN 2,Elementary Italian,5 Units, Italian 1,"Terms offered: Spring 2018, Fall 2017, Spring 2017<br/>
Basic grammar for beginners: Part two.",0
ITALIAN 3,Intermediate Italian,5 Units, 2,"Terms offered: Spring 2018, Fall 2017, Spring 2017<br/>
Grammar review, reading, and written composition.",0
ITALIAN 4,Intermediate Italian,5 Units, 3,"Terms offered: Spring 2018, Fall 2017, Spring 2017<br/>
Selected readings in modern Italian prose; a review of the essentials of grammar; written and oral compositions.",0
ITALIAN R5A,Reading and Composition,4 Units, Satisfaction of the Entry Level Writing Requirement,"Terms offered: Spring 2018, Fall 2017, Fall 2016<br/>
Reading and composition course based on works by Italians and foreigners about Italy and its culture and by Italians about their distinctive experiences of other cultures as tourists and emigrants. Works studied will be primarily chosen from among fiction and non fiction narratives, both originally in English and translated into it. R5A satisfies the first half of the Reading and Composition Requirement and R5B satisfies the second half.",0
ITALIAN R5B,Reading and Composition,4 Units," Previously passed an R_A course with a letter grade of C- or better.<BR/>Previously passed an articulated R_A course with a letter grade of C- or better.<BR/>Score a 4 on the Advanced Placement Exam in English Literature.<BR/>Score a 4 or 5 on the Advanced Placement Exam in English Language and Composition.<BR/>Score of 5, 6, or 7 on the International Baccalaureate Higher Level Examination in English","Terms offered: Summer 2018 8 Week Session, Summer 2018 Second 6 Week Session, Spring 2018<br/>
Reading and composition course based on works by Italians and foreigners about Italy and its culture and by Italians about their distinctive experiences of other cultures as tourists and emigrants. Works studied will be primarily chosen from among fiction and non fiction narratives, both originally in English and translated into it. R5A satisfies the first half of the Reading and Composition Requirement",0
ITALIAN 12,Advanced Conversational Italian,3 Units," 3 or equivalent, or consent of instructor","Terms offered: Spring 2016, Spring 2015, Spring 2014<br/>
The course is designed to develop and enhance oral communication skills at an advanced level, by means of conversational practice, discussion of readings, student presentation or original material, and use of audio-visual materials and realia.",0
ITALIAN 24,Freshman Seminars,1 Unit,,"Terms offered: Spring 2018, Fall 2017, Spring 2017<br/>
The Berkeley Seminar Program has been designed to provide new students with the opportunity to explore an intellectual topic with a faculty member in a small-seminar setting. Berkeley Seminars are offered in all campus departments, and topics vary from department to department and semester to semester.",0
ITALIAN 25,Critical Issues in Interdisciplinary Italian Studies,3 Units,,"Terms offered: Spring 2018<br/>
This course serves as an introduction to Italian Studies in a comparative and interdisciplinary context. In each iteration of the course, students will learn about major intellectual debates in Italian culture and society, viewed in relation to their global context. Topics will vary with instructor.",0
ITALIAN 30,Dante (in English),3 Units,,"Terms offered: Spring 2018, Spring 2017, Fall 2015<br/>
An introduction to Dante's works in the cultural and historical context of the European Middle Ages.",0
ITALIAN 40,Italian Culture (in English),4 Units,,"Terms offered: Fall 2017, Fall 2016, Fall 2015<br/>
Introduction to Italian studies through selected topics and themes integral to the history, literature, and arts of Italy from Dante to Fellini.",0
ITALIAN 70,"Italian Cinema: History, Directors, Genres, Introduction to Italian Cinema",3 Units,,"Terms offered: Spring 2016, Summer 2015 Second 6 Week Session, Summer 2014 Second 6 Week Session<br/>
This course is a brief introduction to the history of Italian cinema. No prior knowledge of Italian cinema or film theory is necessary. We will study major auteurs and genres of Italian cinema in the context of Italian culture and history from 1895 to the present. The course is structured chronologically: we will begin with silent cinema, work our way through the 20th century, and end with contemporary",0
ITALIAN 97,Field Studies,1 - 4 Units, Consent of instructor,"Terms offered: Spring 2018, Fall 2017, Spring 2017<br/>
Supervised field programs involving experiences in schools and school-related activities. Weekly participation commitment, regular individual meetings with faculty supervisor and written reports required.",0
ITALIAN 98,Directed Group Study,1 - 4 Units,,"Terms offered: Fall 2017, Spring 2017, Fall 2016<br/>
Group study of selected topics not covered by regularly scheduled courses.",0
ITALIAN 101,Advanced Writing Workshop,4 Units, Italian 4,"Terms offered: Spring 2018, Fall 2017, Spring 2017<br/>
A writing-intensive course that aims to strengthen writing skills though varied genres, including literary analysis, journalism, and biography, and through multiple revisions. The course is a prerequisite for all upper division courses.",0
ITALIAN 101A,"Advanced Grammar, Reading, and Composition",4 Units, 4,"Terms offered: Fall 2016, Fall 2015, Fall 2014<br/>
Reading and grammatical analysis of representative texts; advanced written composition.",0
ITALIAN 101B,"Advanced Grammar, Reading, and Composition",4 Units, 4,"Terms offered: Spring 2016, Spring 2015, Spring 2014<br/>
Reading and grammatical analysis of representative texts; advanced written composition.",0
ITALIAN 102,Italian through the Arts,4 Units, Italian 101 or departmental placement,"Terms offered: Spring 2018, Spring 2017, Spring 2016<br/>
This course aims to develop advanced oral and aural skills through discussion, debate, performance, and role-play about the arts in Italy, including cinema, theater, the figurative arts, and music.<br/>",0
ITALIAN 103,History of Italian Culture,4 Units,,"Terms offered: Spring 2016, Fall 2014, Fall 2013<br/>
Introduction to the historical development of culture and literature in Italian from the Middle Ages to the present day. Lectures, critical analysis of texts, frequent writing exercises. In Italian.",0
ITALIAN 104,Reading Italian Literature,4 Units,,"Terms offered: Fall 2016, Fall 2015, Spring 2015<br/>
Introduction to basic works of Italian literature (fiction, poetry, drama) with an emphasis on techniques of reading.",0
ITALIAN 105,History of Italian Culture,4 Units, Italian 4 or consent of instructor,"Terms offered: Spring 2018, Spring 2017<br/>
Introduction to the historical development of Italian culture from the Middle Ages to the present, with an emphasis on critical analysis of literary and visual texts in relation to the politics and societies of the Italian peninsula, and an ultimate goal of advancing student’s critical and linguistic skills.",0
ITALIAN 110,Literature and Culture of the 13th and 14th Centuries,4 Units,,"Terms offered: Fall 2016, Spring 2016, Spring 2010<br/>
Emphasis on the literature and culture of the 13th and 14th centuries. Literature will emphasize the ""Stil Novo"" and Dante's minor works as well as Boccaccio's and Petrarch's .",0
ITALIAN 112,Sixteenth-Century Literature and Culture,4 Units,,"Terms offered: Spring 2016, Spring 2015, Spring 2014<br/>
Studies in the literature and culture of the High Renaissance and the Late Renaissance.",0
ITALIAN 117,Twentieth and Twenty-First Century Literature,4 Units,,"Terms offered: Fall 2017, Spring 2016, Fall 2014<br/>
The main trends in the fiction, poetry, prose and theatre of the twentieth and twenty-first centuries.",0
ITALIAN 120,Topics in Italian Studies,4 Units,,"Terms offered: Spring 2018, Fall 2017, Spring 2017<br/>
Three hours of lectures, readings, and discussion per week on major authors, themes, and movements in Italian literature.",0
ITALIAN 130A,Dante's Inferno (in English),4 Units,,"Terms offered: Fall 2017, Fall 2014, Fall 2007<br/>
An introduction to Dante's Inferno in the context of his other works. Taught in English.",0
ITALIAN 150AC,"After Work: Italian Theories, US Texts",3 Units,,"Terms offered: Spring 2018<br/>
This course will ask students to think critically about work and labor in various U.S. contexts, while introducing them to key concepts in late twentieth-century Italian social theory.<br/>
Topics may vary from semester to semester, but the course will always take substantial account of the experiences and histories of representations of different ethnic groups.<br/>",0
ITALIAN 160,"Studies in the History, Society, and Politics of the Italian Peninsula (in Italian)",4 Units, Italian 101 or consent of instructor,"Terms offered: Fall 2017, Spring 2017, Fall 2016<br/>
The course will study Italian culture from the perspective of social and historical forces, as articulated by a broad variety of cultural, ideological, and institutional discourses.",0
ITALIAN 160S,"Studies in the History, Society, and Politics of the Italian Peninsula (in English)",4 Units,,"Terms offered: Spring 2018<br/>
The course will study Italian culture from the perspective of social and historical forces, as articulated by a broad variety of cultural, ideological, and institutional discourses.",0
ITALIAN 170,"The Italian Cinema: History, Genres, Authors",4 Units,,"Terms offered: Spring 2018, Fall 2017, Spring 2017<br/>
An analysis of Italian cinema as seen in the development of specific film genres such as neorealism, comedy, self-reflexive cinema. Occasionally the course will concentrate on a specific director and study his individuality through style, theme, and personal development. This course fulfills film major requirement in one of history, genre, auteur.",0
ITALIAN H195,Special Studies for Honors Candidates,3 Units," 3.3 overall GPA, 3.5 GPA in the major and must have completed at least 18 upper division units in the major","Terms offered: Spring 2018, Fall 2017, Spring 2017<br/>
Limited to senior honors candidates. Directed study relating to the writing of an honors thesis.",0
ITALIAN 197,Field Studies,1 - 4 Units, Consent of instructor,"Terms offered: Spring 2018, Fall 2017, Spring 2017<br/>
Supervised field programs involving experiences in schools and school-related activities. Weekly participation commitment, regular individual meetings with faculty supervisor and written reports required.",0
ITALIAN 198,Directed Group Study,1 - 4 Units, Students must have completed 60 units and have a minimum GPA of 2.0,"Terms offered: Spring 2018, Fall 2017, Spring 2017<br/>
Supervised group study of selected topics not covered by regularly scheduled courses.",0
ITALIAN 199,Supervised Independent Study and Research for Advanced Undergraduates,1 - 4 Units, Restricted to senior students with overall GPA of 3.0 or better,"Terms offered: Spring 2018, Fall 2017, Spring 2017<br/>
Enrollment restrictions apply; see the Introduction to the Course and Curricula section of this catalog.",0
ITALIAN C201,Linguistic History of the Romance Language,4 Units," Knowledge of at least two of the major Romance languages (French, Italian, and Spanish)","Terms offered: Spring 2018, Fall 2015, Fall 2014, Fall 2011, Fall 2009<br/>
Linguistic development of the major Romance languages (French, Italian, and Spanish) from the common Latin origin. Comparative perspective, combining historical grammar and external history.",0
ITALIAN C203,Comparative Studies in Romance Literatures and Cultures,4 Units,,"Terms offered: Spring 2016, Spring 2015, Spring 2014, Fall 2012<br/>
Topics will vary. Comparative studies in literary, cultural, or historical issues that cut across the literatures of the Romance languages.",0
ITALIAN 204,Contemporary Trends in Critical Theory,2 or 4 Units,,"Terms offered: Fall 2017, Spring 2017, Fall 2013<br/>
This course is designed to provide the student with a general view of the major developments in contemporary criticism and an opportunity to apply critical methods to literary texts. One oral report and a final paper.",0
ITALIAN 205,Proseminar I: Italian Literary Studies,2 or 4 Units,,"Terms offered: Fall 2017, Fall 2015, Fall 2013<br/>
This course introduces the study of Italian literature in its historical scope, while presenting the range of research interests represented on the Italian Studies faculty. Required of all Master of Arts candidates.",0
ITALIAN 215,Seminar in Renaissance Literature and Culture,2 or 4 Units,,"Terms offered: Spring 2018, Fall 2016, Spring 2016<br/>
Investigation of major topics, genres, and authors in Italian literature and culture of the 15th and 16th centuries.",0
ITALIAN 235,Seminar in 20th Century Literature and Culture,2 or 4 Units,,"Terms offered: Fall 2016, Spring 2016, Spring 2015<br/>
Investigation of major topics, genres, and authors in Italian literature and culture of the 20th century.",0
ITALIAN 244,Special Topics in Genre and Mode,2 or 4 Units,,"Terms offered: Fall 2016, Fall 2011, Spring 2010<br/>
Investigation of significant genres and modes of writing as they recur in the course of Italian cultural history.",0
ITALIAN 248,Special Topics in Interdisciplinary Italian Studies,2 or 4 Units,,"Terms offered: Spring 2018, Spring 2017, Spring 2016<br/>
Investigation of topics in Italian cultural history from a multidisciplinary perspective.",0
ITALIAN 260,Directed Readings in Italian Literature and Culture,2 Units, Consent of instructor,"Terms offered: Spring 2018, Fall 2017, Spring 2017<br/>
Directed readings undertaken under the direction of a faculty member of the department of Italian Studies in conjunction with an audit of a 100-series seminar.",0
ITALIAN 270,Seminar Research Course,1 Unit, Consent of instructor,"Terms offered: Spring 2018, Fall 2017, Spring 2017<br/>
Directed research leading to the writing of a term paper under the direction of an Italian Studies department faculty member. Requires concurrent enrollment in a 100-series seminar.",0
ITALIAN 282,Prospectus Tutorial,4 Units, Consent of instructor,"Terms offered: Spring 2018, Fall 2017, Spring 2017<br/>
Directed reading course leading to the production of a formal dissertation prospectus with detailed bibliography. Course is required for all Doctor of Philosophy candidates.",0
ITALIAN 290A,Graduate Colloquium in Italian Studies,2 Units, Graduate standing in Italian studies,"Terms offered: Fall 2017, Fall 2016, Fall 2015<br/>
Reports on current scholarly work by faculty and graduate students.",0
ITALIAN 290B,Graduate Colloquium in Italian Studies,2 Units, Graduate standing in Italian studies,"Terms offered: Spring 2018, Spring 2017, Spring 2016<br/>
Reports on current scholarly work by faculty and graduate students.",0
ITALIAN 298,Special Study,1 - 4 Units, Consent of the instructor,"Terms offered: Spring 2018, Fall 2017, Summer 2017 10 Week Session<br/>
Designed to allow students to do research in areas not covered by other courses. Requires regular discussions with the instructor and a final written report.",0
ITALIAN 299,Directed Research,6 - 12 Units,,"Terms offered: Spring 2018, Fall 2017, Spring 2017<br/>
Limited to students engaged in research for the doctoral dissertation.",0
ITALIAN N299,Directed Research,3 - 6 Units,,"Terms offered: Summer 2017 10 Week Session, Summer 2016 10 Week Session, Summer 2015 10 Week Session<br/>
Limited to students engaged in research for the doctoral dissertation.",0
ITALIAN 302,Practicum in College Teaching of Italian,2 - 4 Units, 301. Concurrent service as Italian graduate student instructor,"Terms offered: Spring 2018, Fall 2017, Spring 2017<br/>",0
ITALIAN 303,"Practicum in the Teaching of Italian Literature, History, and Culture",2 - 4 Units, Required of Italian Studies Department GSIs not enrolled in 302 or 355 or in an approved Reading and Composition pedagogy course,"Terms offered: Spring 2018, Fall 2017, Spring 2017<br/>
Three hours of classroom teaching per week with regular faculty supervision; attendance at faculty lectures where appropriate; routine meetings to discuss and evaluate teaching methods, including lecturing, discussion, classroom activities, grading and testing, design of syllabi and course materials.",0
ITALIAN 375,Seminar in Language Pedagogy,4 Units, Graduate student instructor status,"Terms offered: Fall 2017, Fall 2016, Fall 2015<br/>
Required of all graduate student instructors in their first semester of teaching. This course provides instruction on the theory and practice of foreign language teaching and learning with lectures on methodology, testing, grading, class preparation, textbook selection and evaluation, course design and development, and the use of audio-visual and computer aids to instruction. A final research paper is required. It also includes supervised classroom",0
ITALIAN 601,Individual Studies for M.A. Candidates,1 - 8 Units,,"Terms offered: Spring 2018, Fall 2017, Spring 2017<br/>
Individual study in consultation with faculty member with a view to the M.A. comprehensive examination. May be taken only in the semester of the comprehensive examination.",0
ITALIAN 602,Individual Studies for Doctoral Students,1 - 8 Units,,"Terms offered: Spring 2018, Fall 2017, Spring 2017<br/>
Individual study in consultation with a faculty adviser. Intended to provide an opportunity for qualified students to prepare for the Ph.D. qualifying examination. May be taken only in the semester of the qualifying examination.",0
