code,title,units,prereqs,offered,corrupt
LINGUIS 221,Advanced Logical Semantics,3 Units,,"Terms offered: Fall 2017, Spring 2016, Spring 2014<br/>
This course is designed to introduce graduate students to the core principles and empirical issues addressed<br/>
by formal semantics and to familiarize them with the analytical tools involved in the investigation of this<br/>
domain. The focus of this class is truth-conditional aspects of meaning and the compositional interpretation<br/>
of phrases and sentences. Students will develop skills in semantic analysis and argumentation by focusing<br/>",0
LINGUIS 230,Historical Linguistics,3 Units, 110. Graduate standing or consent of instructor,"Terms offered: Spring 2018, Spring 2017, Spring 2016<br/>
The scholarly tradition of historical and comparative linguistics. Methods of reconstruction.",0
LINGUIS 234,Indo-European Linguistics,3 Units, An introductory historical linguistics course or a good knowledge of an older Indo-European language,"Terms offered: Spring 2016, Fall 2013, Spring 2012<br/>
A survey of Indo-European (IE) linguistics, intended for general linguists interested in learning about the most fully developed sub-area of historical linguistics and for language-area specialists interested in how specific language areas relate to IE as a whole. All areas of the field will be surveyed (phonology, morphology, syntax, lexical semantics, cultural reconstruction, and subgrouping and diversification), with special emphasis on",0
LINGUIS 240A,Field Methods,4 Units, Linguistics 211A and Linguistics 220A. Graduate standing or consent of instructor,"Terms offered: Fall 2017, Fall 2016, Fall 2015<br/>
Training in elicitation and analysis of linguistic data in a simulated field setting. The same language is used throughout the year. Linguistics 240B is the continuation of 240A.",0
LINGUIS 240B,Field Methods,4 Units, Linguistics 240A,"Terms offered: Spring 2018, Spring 2017, Spring 2016<br/>
Training in elicitation and analysis of linguistic data in a simulated field setting. The same language is used throughout the year. Linguistics 240B is the continuation of 240A.",0
LINGUIS 243,"Language, Computation, and Cognition",3 Units, Consent of instructor,"Terms offered: Spring 2018, Spring 2017<br/>
Seminars or special lecture courses.",0
LINGUIS 245,Anthropological Linguistics,3 Units, Graduate standing or consent of instructor,"Terms offered: Fall 2016, Spring 2010<br/>
Graduate level survey of anthropological linguistics which seeks to understand the role of culture in linguistic meaning, language use, and the development of linguistic form and, conversely, the role of linguistic form and structure in social action and in cultural practices.",0
LINGUIS 290A,Topics in Linguistic Theory: Syntax,3 Units, Consent of instructor,"Terms offered: Fall 2016, Spring 2016, Fall 2013<br/>
Seminars or special lecture courses.",0
LINGUIS 290E,Topics in Linguistic Theory: Phonology,3 Units, Consent of instructor,"Terms offered: Spring 2017, Fall 2015, Spring 2015<br/>
Seminars or special lecture courses.",0
LINGUIS 290L,Additional Seminar on Special Topics to Be Announced,3 Units, Consent of instructor,"Terms offered: Fall 2016, Fall 2014, Fall 2013<br/>
Seminar or special lecture courses on linguistic topics.",0
LINGUIS 290M,Topics in Linguistic Theory: Psycholinguistics,3 Units, Consent of instructor,"Terms offered: Spring 2018, Fall 2011, Fall 2010<br/>
Seminars or special lecture courses.",0
LINGUIS 297,Research Mentorship,1 - 2 Units,,"Terms offered: Spring 2018, Fall 2017, Spring 2017<br/>
Mentor undergraduates in research on projects in the subfields of linguistics, sponsored by a faculty member; written report required.",0
LINGUIS 298,Special Group Study,2 - 8 Units, One full year of graduate study at Berkeley or consent of graduate adviser,"Terms offered: Spring 2018, Fall 2017, Spring 2017<br/>",0
LINGUIS 375,Training for Linguistics Teaching Assistants,2 Units," 110, 120 and 130 or consent of instructor","Terms offered: Fall 2017, Fall 2016, Fall 2015<br/>
A teaching-methods ""clinic"" for first-time Linguistics GSI's. Sessions will deal with the presentation of linguistic concepts in each of the foundation courses, the creation of homework assignments and examination, policies and practices regarding correction of students' work, grading, and feedback.",0
LINGUIS 700,Colloquium,0.0 Units,,"Terms offered: Fall 2017, Fall 2016<br/>
Colloquium lecture presentations by Berkeley faculty and students, and invited visitors, on topics in language and linguistics. Department students and faculty offer feedback, suggestions, and critiques on work in progress.",0
