code,title,units,prereqs,offered,corrupt
STAT 0PX,Preparatory Statistics,1 Unit, Consent of instructor,"Terms offered: Summer 2016 10 Week Session, Summer 2015 10 Week Session, Summer 2014 10 Week Session<br/>
This course assists entering Freshman students with basic statistical concepts and problem solving. Designed for students who do not meet the prerequisites for 2. Offered through the Student Learning Center.",0
STAT 2,Introduction to Statistics,4 Units,,"Terms offered: Summer 2018 8 Week Session, Spring 2018, Fall 2017<br/>
Population and variables. Standard measures of location, spread and association. Normal approximation. Regression. Probability and sampling. Binomial distribution. Interval estimation. Some standard significance tests.",0
STAT C8,Foundations of Data Science,4 Units," This course may be taken on its own, but students are encouraged to take it concurrently with a data science connector course (numbered 88 in a range of departments)","Terms offered: Summer 2018 8 Week Session, Spring 2018, Fall 2017, Summer 2017 8 Week Session<br/>
Foundations of data science from three perspectives: inferential thinking, computational thinking, and real-world relevance. Given data arising from some real-world phenomenon, how does one analyze that data so as to understand that phenomenon? The course teaches critical concepts and skills in computer programming and statistical inference, in conjunction with hands-on analysis of real-world datasets",0
STAT 20,Introduction to Probability and Statistics,4 Units, One semester of calculus,"Terms offered: Summer 2018 8 Week Session, Spring 2018, Fall 2017<br/>
For students with mathematical background who wish to acquire basic concepts. Relative frequencies, discrete probability, random variables, expectation. Testing hypotheses. Estimation. Illustrations from various fields.",0
STAT 21,Introductory Probability and Statistics for Business,4 Units, One semester of calculus,"Terms offered: Fall 2016, Fall 2015, Fall 2014<br/>
Descriptive statistics, probability models and related concepts, sample surveys, estimates, confidence intervals, tests of significance, controlled experiments vs. observational studies, correlation and regression.",0
STAT W21,Introductory Probability and Statistics for Business,4 Units, One semester of calculus,"Terms offered: Summer 2018 8 Week Session, Spring 2018, Summer 2017 8 Week Session<br/>
Reasoning and fallacies, descriptive statistics, probability models and related concepts, combinatorics, sample surveys, estimates, confidence intervals, tests of significance, controlled experiments vs. observational studies, correlation and regression.",0
STAT 24,Freshman Seminars,1 Unit,,"Terms offered: Fall 2016, Fall 2003, Spring 2001<br/>
The Berkeley Seminar Program has been designed to provide new students with the opportunity to explore an intellectual topic with a faculty member in a small-seminar setting. Berkeley seminars are offered in all campus departments, and topics vary from department to department and semester to semester. Enrollment limited to 15 freshmen.",0
STAT 28,Statistical Methods for Data Science,4 Units," Statistics/Information/Computer Science C8 is the only course prerequisite. In addition, mathematical fluency and comfort at the level of precalculus (Math 32) is expected","Terms offered: Spring 2018, Spring 2017<br/>
This is a lower-division course that is a follow-up to STAT8/CS8 (Foundations of Data Science). The course will teach a broad range of statistical methods that are used to solve data problems. Topics will include group comparisons and ANOVA, standard parametric statistical models, multivariate data visualization, multiple linear regression and classification, classification and regression trees and random forests. An important focus of the course will",0
STAT 88,Probability and Mathematical Statistics in Data Science,2 Units," One semester of calculus. This course is meant to be taken concurrently with Computer Science C8/Statistics C8/Information C8. Students may take more than one 88 (data science connector) course if they wish, ideally concurrent with or after having taken the C8 course","Terms offered: Spring 2018, Fall 2017, Spring 2017<br/>
In this connector course we will state precisely and prove results discovered in the foundational data science course through working with data. Topics include: total variation distance between discrete distributions; the mean, standard deviation, and tail bounds; correlation, and the derivation of the regression equation; probabilities, random variables, and the Central Limit Theorem; probabilistic models; symmetries in random permutations;",0
STAT 89A,Linear Algebra for Data Science,4 Units, One year of calculus. Prerequisite or corequisite: Foundations of Data Science (,"Terms offered: Spring 2018, Spring 2017, Spring 2016<br/>
An introduction to linear algebra for data science. The course will cover introductory topics in linear algebra, starting with the basics; discrete probability and how prob- ability can be used to understand high-dimensional vector spaces; matrices and graphs as popular mathematical structures with which to model data (e.g., as models for term-document corpora, high-dimensional regression problems, ranking/classification of web data, adjacency",1
STAT C100,Principles & Techniques of Data Science,4 Units, Computer Science/Information/Statistics C8 or Engineering 7; and either Computer Science 61A or Computer Science 88. Corequisite: Mathematics 54 or Electrical Engineering 16A,"Terms offered: Spring 2018, Fall 2017, Spring 2017<br/>
In this course, students will explore the data science lifecycle, including question formulation, data collection and cleaning, exploratory data analysis and visualization, statistical inference and prediction​, and decision-making.​ This class will focus on quantitative critical thinking​ and key principles and techniques needed to carry out this cycle. These include languages for transforming, querying and analyzing data; algorithms for machine",0
STAT 131A,Introduction to Probability and Statistics for Life Scientists,4 Units, One semester of calculus or consent of instructor,"Terms offered: Spring 2018, Fall 2017, Spring 2017<br/>
Ideas for estimation and hypothesis testing basic to applications, including an introduction to probability. Linear estimation and normal regression theory.",0
STAT 133,Concepts in Computing with Data,3 Units,,"Terms offered: Spring 2018, Fall 2017, Summer 2017 10 Week Session<br/>
An introduction to computationally intensive applied statistics. Topics will include organization and use of databases, visualization and graphics, statistical learning and data mining, model validation procedures, and the presentation of results.",0
STAT 134,Concepts of Probability,4 Units, One year of calculus,"Terms offered: Summer 2018 8 Week Session, Spring 2018, Fall 2017<br/>
An introduction to probability, emphasizing concepts and applications. Conditional expectation, independence, laws of large numbers. Discrete and continuous random variables. Central limit theorem. Selected topics such as the Poisson process, Markov chains, characteristic functions.",0
STAT 135,Concepts of Statistics,4 Units, Statistics 134 and linear algebra (Mathematics 54 or equivalent). Statistics 133 strongly recommended,"Terms offered: Summer 2018 8 Week Session, Spring 2018, Fall 2017<br/>
A comprehensive survey course in statistical theory and methodology. Topics include descriptive statistics, maximum likelihood estimation, non-parametric methods, introduction to optimality, goodness-of-fit tests, analysis of variance, bootstrap and computer-intensive methods and least squares estimation. The laboratory includes computer-based data-analytic applications to science and engineering.",0
STAT 140,Probability for Data Science,4 Units," Statistics/Computer Science/Information C8 and one year of calculus at the level of Mathematics 1A-1B or higher. Co-requisite: Mathematics 54, Electrical Engineering 16A, or equivalent linear algebra course","Terms offered: Spring 2018, Spring 2017<br/>
An introduction to probability, emphasizing the combined use of mathematics and programming to solve problems. Random variables, discrete and continuous families of distributions. Bounds and approximations. Dependence, conditioning, Bayes methods. Convergence, Markov chains. Least squares prediction. Random permutations, symmetry, order statistics. Use of numerical computation, graphics, simulation, and computer algebra.",0
STAT 150,Stochastic Processes,3 Units, 101 or 103A or 134,"Terms offered: Spring 2018, Fall 2017, Fall 2016<br/>
Random walks, discrete time Markov chains, Poisson processes. Further topics such as: continuous time Markov chains, queueing theory, point processes, branching processes, renewal theory, stationary processes, Gaussian processes.",0
STAT 151A,Linear Modelling: Theory and Applications,4 Units, 102 or 135. 133 recommended,"Terms offered: Spring 2018, Fall 2017, Spring 2017<br/>
A coordinated treatment of linear and generalized linear models and their application. Linear regression, analysis of variance and covariance, random effects, design and analysis of experiments, quality improvement, log-linear models for discrete multivariate data, model selection, robustness, graphical techniques, productive use of computers, in-depth case studies.",0
STAT 152,Sampling Surveys,4 Units, 101 or 134. 133 and 135 recommended,"Terms offered: Spring 2018, Spring 2017, Spring 2016<br/>
Theory and practice of sampling from finite populations. Simple random, stratified, cluster, and double sampling. Sampling with unequal probabilities. Properties of various estimators including ratio, regression, and difference estimators. Error estimation for complex samples.",0
STAT 153,Introduction to Time Series,4 Units," 101, 134 or consent of instructor. 133 or 135 recommended","Terms offered: Spring 2018, Fall 2017, Spring 2017<br/>
An introduction to time series analysis in the time domain and spectral domain. Topics will include: estimation of trends and seasonal effects, autoregressive moving average models, forecasting, indicators, harmonic analysis, spectra.",0
STAT 154,Modern Statistical Prediction and Machine Learning,4 Units, Mathematics 53 and 54 or equivalents; Statistics 135 or equivalent; experience with some programming language. Mathematics 55 or equivalent exposure to counting arguments is recommended but not required,"Terms offered: Spring 2018, Fall 2017, Spring 2017<br/>
Theory and practice of statistical prediction. Contemporary methods as extensions of classical methods. Topics: optimal prediction rules, the curse of dimensionality, empirical risk, linear regression and classification, basis expansions, regularization, splines, the bootstrap, model selection, classification and regression trees, boosting, support vector machines. Computational efficiency versus predictive performance. Emphasis on experience",0
STAT 155,Game Theory,3 Units, 101 or 134,"Terms offered: Summer 2018 8 Week Session, Spring 2018, Fall 2017<br/>
General theory of zero-sum, two-person games, including games in extensive form and continuous games, and illustrated by detailed study of examples.",0
STAT 157,Seminar on Topics in Probability and Statistics,3 Units," Mathematics 53-54, Statistics 134, 135. Knowledge of scientific computing environment (R or Matlab) often required. Prerequisites might vary with instructor and topics","Terms offered: Fall 2017, Fall 2016, Spring 2016<br/>
Substantial student participation required. The topics to be covered each semester that the course may be offered will be announced by the middle of the preceding semester; see departmental bulletins. Recent topics include: Bayesian statistics, statistics and finance, random matrix theory, high-dimensional statistics.",0
STAT 158,The Design and Analysis of Experiments,4 Units, Statistics 134 and 135 or consent of instructor. Statistics 135 may be taken concurrently. Statistics 133 is recommended,"Terms offered: Spring 2018, Spring 2016, Spring 2015<br/>
An introduction to the design and analysis of experiments. This course covers planning, conducting, and analyzing statistically designed experiments with an emphasis on hands-on experience. Standard designs studied include factorial designs, block designs, latin square designs, and repeated measures designs. Other topics covered include the principles of design, randomization, ANOVA, response surface methodoloy, and computer experiments.",0
STAT 159,Reproducible and Collaborative Statistical Data Science,4 Units," Statistics 133, Statistics 134, and Statistics 135 (or equivalent)","Terms offered: Fall 2017, Fall 2016, Fall 2015<br/>
A project-based introduction to statistical data analysis. Through case studies, computer laboratories, and a term project, students will learn practical techniques and tools for producing statistically sound and appropriate, reproducible, and verifiable computational answers to scientific questions. Course emphasizes version control, testing, process automation, code review, and collaborative programming. Software tools may include Bash, Git,",0
STAT 197,Field Study in Statistics,1 - 3 Units,,"Terms offered: Spring 2017, Fall 2015, Summer 2015 10 Week Session<br/>
Supervised experience relevant to specific aspects of statistics in off-campus settings. Individual and/or group meetings with faculty.",0
STAT 198,Directed Study for Undergraduates,1 - 3 Units, Consent of instructor,"Terms offered: Spring 2018, Spring 2016, Fall 2015<br/>
Special tutorial or seminar on selected topics.",0
STAT 199,Supervised Independent Study and Research,1 - 3 Units,,"Terms offered: Spring 2017, Fall 2015, Spring 2015<br/>",0
STAT 201A,Introduction to Probability at an Advanced Level,4 Units," Multivariable calculus, one semester of linear algebra, and Statistics 134 or consent of instructor","Terms offered: Fall 2017, Fall 2016, Fall 2015<br/>
Distributions in probability and statistics, central limit theorem, Poisson processes, modes of convergence, transformations involving random variables.",0
STAT 201B,Introduction to Statistics at an Advanced Level,4 Units," Statistics 200A, Statistics 201A, or consent of instructor","Terms offered: Fall 2017, Fall 2016, Fall 2015<br/>
Estimation, confidence intervals, hypothesis testing, linear models, large sample theory, categorical models, decision theory.",0
STAT 204,Probability for Applications,4 Units,,"Terms offered: Spring 2017, Spring 2015, Fall 2012<br/>
A treatment of ideas and techniques most commonly found in the applications of probability: Gaussian and Poisson processes, limit theorems, large deviation principles, information, Markov chains and Markov chain Monte Carlo, martingales, Brownian motion and diffusion.",0
STAT C205A,Probability Theory,4 Units,,"Terms offered: Fall 2017, Fall 2016, Fall 2015<br/>
The course is designed as a sequence with Statistics C205B/Mathematics C218B with the following combined syllabus. Measure theory concepts needed for probability. Expection, distributions. Laws of large numbers and central limit theorems for independent random variables. Characteristic function methods. Conditional expectations, martingales and martingale convergence theorems. Markov chains. Stationary processes. Brownian motion.",0
STAT C205B,Probability Theory,4 Units,,"Terms offered: Spring 2018, Spring 2017, Spring 2016<br/>
The course is designed as a sequence with with Statistics C205A/Mathematics C218A with the following combined syllabus. Measure theory concepts needed for probability. Expection, distributions. Laws of large numbers and central limit theorems for independent random variables. Characteristic function methods. Conditional expectations, martingales and martingale convergence theorems. Markov chains. Stationary processes. Brownian motion.",0
STAT C206A,Advanced Topics in Probability and Stochastic Process,3 Units, Statistics C205A-C205B or consent of instructor,"Terms offered: Fall 2016, Fall 2015, Fall 2014, Fall 2013<br/>
The topics of this course change each semester, and multiple sections may be offered. Advanced topics in probability offered according to students demand and faculty availability.",0
STAT C206B,Advanced Topics in Probability and Stochastic Processes,3 Units,,"Terms offered: Spring 2018, Spring 2017, Spring 2016<br/>
The topics of this course change each semester, and multiple sections may be offered. Advanced topics in probability offered according to students demand and faculty availability.",0
STAT 210A,Theoretical Statistics,4 Units," Linear algebra, real analysis, and a year of upper division probability and statistics","Terms offered: Fall 2017, Fall 2016, Fall 2015<br/>
An introduction to mathematical statistics, covering both frequentist and Bayesian aspects of modeling, inference, and decision-making. Topics include statistical decision theory; point estimation; minimax and admissibility; Bayesian methods; exponential families; hypothesis testing; confidence intervals; small and large sample theory; and M-estimation.",0
STAT 210B,Theoretical Statistics,4 Units, Statistics 210A and a graduate level probability course; a good understanding of various notions of stochastic convergence,"Terms offered: Spring 2018, Spring 2017, Spring 2016<br/>
Introduction to modern theory of statistics; empirical processes, influence functions, M-estimation, U and V statistics and associated stochastic decompositions; non-parametric function estimation and associated minimax theory; semiparametric models; Monte Carlo methods and bootstrap methods; distributionfree and equivariant procedures; topics in machine learning. Topics covered may vary with instructor.",0
STAT 212B,Topics in Theoretical Statistics,3 Units, 210 or 205 and 215,"Terms offered: Spring 2016<br/>
This course introduces the student to topics of current research interest in theoretical statistics. Recent topics include information theory, multivariate analysis and random matrix theory, high-dimensional inference. Typical topics have been model selection; empirical and point processes; the bootstrap, stochastic search, and Monte Carlo integration; information theory and statistics; semi- and non-parametric modeling; time series and survival analysis.",0
STAT 215A,Statistical Models: Theory and Application,4 Units," Linear algebra, calculus, upper division probability and statistics, and familiarity with high-level programming languages. Statistics 133, 134, and 135 recommended","Terms offered: Fall 2017, Fall 2016, Fall 2015<br/>
Applied statistics with a focus on critical thinking, reasoning skills, and techniques. Hands-on-experience with solving real data problems with high-level programming languages such as R. Emphasis on examining the assumptions behind standard statistical models and methods. Exploratory data analysis (e.g., graphical data summaries, PCAs, clustering analysis). Model formulation, fitting, and validation and testing. Linear regression and generalizations",0
STAT 215B,Statistical Models: Theory and Application,4 Units, Statistics 215A or consent of instructor,"Terms offered: Spring 2018, Spring 2017, Spring 2016<br/>
Course builds on 215A in developing critical thinking skills and the techniques of advanced applied statistics. Particular topics vary with instructor. Examples of possible topics include planning and design of experiments, ANOVA and random effects models, splines, classification, spatial statistics, categorical data analysis, survival analysis, and multivariate analysis.",0
STAT 222,Masters of Statistics Capstone Project,4 Units," Statistics 201A-201B, 243. Restricted to students who have been admitted to the one-year Masters Program in Statistics beginning fall 2012 or later","Terms offered: Spring 2018, Spring 2017, Spring 2016<br/>
The capstone project is part of the masters degree program in statistics. Students engage in professionally-oriented group research under the supervision of a research advisor. The research synthesizes the statistical, computational, economic, and social issues involved in solving complex real-world problems.",0
STAT 230A,Linear Models,4 Units," Matrix algebra, a year of calculus, two semesters of upper division or graduate probability and statistics","Terms offered: Spring 2018, Spring 2017, Spring 2016<br/>
Theory of least squares estimation, interval estimation, and tests under the general linear fixed effects model with normally distributed errors. Large sample theory for non-normal linear models. Two and higher way layouts, residual analysis. Effects of departures from the underlying assumptions. Robust alternatives to least squares.",0
STAT 238,Bayesian Statistics,3 Units," Probability and mathematical statistics at the level of Stat 134 and Stat 135 or, ideally, Stat 201A and Stat 201B","Terms offered: Fall 2016<br/>
Bayesian methods and concepts: conditional probability, one-parameter and multiparameter models, prior distributions, hierarchical and multi-level models, predictive checking and sensitivity analysis, model selection, linear and generalized linear models, multiple testing and high-dimensional data, mixtures, non-parametric methods. Case studies of applied modeling. In-depth computational implementation using Markov chain Monte Carlo and other techniques. Basic theory",0
STAT 239B,Quantitative Methodology in the Social Sciences Seminar,4 Units, Statistics 239A or equivalent,"Terms offered: Spring 2016, Spring 2015<br/>
A seminar on successful research designs and a forum for students to discuss the research methods needed in their own work, supplemented by lectures on relevant statistical and computational topics such as matching methods, instrumental variables, regression discontinuity, and Bayesian, maximum likelihood and robust estimation. Applications are drawn from political science, economics, sociology, and public health. Experience with R is assumed.",0
STAT C239A,The Statistics of Causal Inference in the Social Science,4 Units,,"Terms offered: Fall 2017, Fall 2016, Fall 2013<br/>
Approaches to causal inference using the potential outcomes framework. Covers observational studies with and without ignorable treatment assignment, randomized experiments with and without noncompliance, instrumental variables, regression discontinuity, sensitivity analysis and randomization inference. Applications are drawn from a variety of fields including political science, economics, sociology, public health and medicine.",0
STAT C239B,Quantitative Methodology in the Social Sciences Seminar,4 Units,,"Terms offered: Spring 2018, Spring 2017<br/>
A seminar on successful research designs and a forum for students to discuss the research methods needed in their own work, supplemented by lectures on relevant statistical and computational topics such as matching methods, instrumental variables, regression discontinuity, and Bayesian, maximum likelihood and robust estimation. Applications are drawn from political science, economics, sociology, and public health. Experience with R is assumed.",0
STAT 240,Nonparametric and Robust Methods,4 Units, A year of upper division probability and statistics,"Terms offered: Fall 2017, Fall 2016, Spring 2015<br/>
Standard nonparametric tests and confidence intervals for continuous and categorical data; nonparametric estimation of quantiles; robust estimation of location and scale parameters. Efficiency comparison with the classical procedures.",0
STAT C241A,Statistical Learning Theory,3 Units,,"Terms offered: Fall 2016, Fall 2015, Fall 2014<br/>
Classification regression, clustering, dimensionality, reduction, and density estimation. Mixture models, hierarchical models, factorial models, hidden Markov, and state space models, Markov properties, and recursive algorithms for general probabilistic inference nonparametric methods including decision trees, kernal methods, neural networks, and wavelets. Ensemble methods.",0
STAT C241B,Advanced Topics in Learning and Decision Making,3 Units,,"Terms offered: Spring 2017, Spring 2016, Spring 2014<br/>
Recent topics include: Graphical models and approximate inference algorithms. Markov chain Monte Carlo, mean field and probability propagation methods. Model selection and stochastic realization. Bayesian information theoretic and structural risk minimization approaches. Markov decision processes and partially observable Markov decision processes. Reinforcement learning.",0
STAT 243,Introduction to Statistical Computing,4 Units, Graduate standing,"Terms offered: Fall 2017, Fall 2016, Fall 2015<br/>
Concepts in statistical programming and statistical computation, including programming principles, data and text manipulation, parallel processing, simulation, numerical linear algebra, and optimization.",0
STAT C245A,Introduction to Modern Biostatistical Theory and Practice,4 Units, Statistics 200A (may be taken concurrently),"Terms offered: Spring 2018, Spring 2017, Spring 2016<br/>
Course covers major topics in general statistical theory, with a focus on statistical methods in epidemiology. The course provides a broad theoretical framework for understanding the properties of commonly-used and more advanced methods. Emphasis is on estimation in nonparametric models in the context of contingency tables, regression (e.g., linear, logistic), density estimation and more. Topics include maximum likelihood and loss-based estimation",0
