code,title,units,prereqs,offered,corrupt
STAT C245B,Biostatistical Methods: Survival Analysis and Causality,4 Units, Statistics 200B (may be taken concurrently),"Terms offered: Fall 2017, Fall 2015, Fall 2013<br/>
Analysis of survival time data using parametric and non-parametric models, hypothesis testing, and methods for analyzing censored (partially observed) data with covariates. Topics include marginal estimation of a survival function, estimation of a generalized multivariate linear regression model (allowing missing covariates and/or outcomes), estimation of a multiplicative intensity model (such as Cox proportional hazards model) and estimation of",0
STAT C245C,Biostatistical Methods: Computational Statistics with Applications in Biology and Medicine,4 Units, Statistics 200A or equivalent (may be taken concurrently),"Terms offered: Fall 2016, Fall 2015, Fall 2014, Fall 2012<br/>
This course provides an introduction to computational statistics, with emphasis on statistical methods and software for addressing high-dimensional inference problems in biology and medicine. Topics include numerical and graphical data summaries, loss-based estimation (regression, classification, density estimation), smoothing, EM algorithm, Markov chain Monte-Carlo, clustering, multiple testing, resampling, hidden Markov models, in",0
STAT C245D,Biostatistical Methods: Computational Statistics with Applications in Biology and Medicine II,4 Units, Statistics 200A-200B or Statistics 201A-201B (may be taken concurrently) or consent of instructor,"Terms offered: Fall 2017, Fall 2015, Fall 2013<br/>
This course and Pb Hlth C240C/Stat C245C provide an introduction to computational statistics with emphasis on statistical methods and software for addressing high-dimensional inference problems that arise in current biological and medical research. The courses also discusses statistical computing resources, with emphasis on the R language and environment (www.r-project.org). Programming topics to be discussed include: data structures, functions",0
STAT C245F,Statistical Genomics,4 Units,,"Terms offered: Spring 2018, Spring 2017, Spring 2016, Spring 2015<br/>
Genomics is one of the fundamental areas of research in the biological sciences and is rapidly becoming one of the most important application areas in statistics. The first course in this two-semester sequence is Public Health C240E/Statistics C245E. This is the second course, which focuses on sequence analysis, phylogenetics, and high-throughput microarray and sequencing gene expression experiments. The courses are primarily",0
STAT C247C,Longitudinal Data Analysis,4 Units," 142, 145, 241 or equivalent courses in basic statistics, linear and logistic regression","Terms offered: Fall 2017, Fall 2016, Fall 2015<br/>
The course covers the statistical issues surrounding estimation of effects using data on subjects followed through time. The course emphasizes a regression model approach and discusses disease incidence modeling and both continuous outcome data/linear models and longitudinal extensions to nonlinear models (e.g., logistic and Poisson). The primary focus is from the analysis side, but mathematical intuition behind the procedures will also be discussed.",0
STAT 248,Analysis of Time Series,4 Units, 102 or equivalent,"Terms offered: Spring 2018, Spring 2017, Spring 2016<br/>
Frequency-based techniques of time series analysis, spectral theory, linear filters, estimation of spectra, estimation of transfer functions, design, system identification, vector-valued stationary processes, model building.",0
STAT 259,Reproducible and Collaborative Statistical Data Science,4 Units," Statistics 133, Statistics 134, and Statistics 135 (or equivalent)","Terms offered: Fall 2017, Spring 2016, Fall 2015<br/>
A project-based introduction to statistical data analysis. Through case studies, computer laboratories, and a term project, students will learn practical techniques and tools for producing statistically sound and appropriate, reproducible, and verifiable computational answers to scientific questions. Course emphasizes version control, testing, process automation, code review, and collaborative programming. Software tools may include Bash, Git",0
STAT 260,Topics in Probability and Statistics,3 Units,,"Terms offered: Spring 2018, Spring 2017, Spring 2016<br/>
Special topics in probability and statistics offered according to student demand and faculty availability.",0
STAT C261,Quantitative/Statistical Research Methods in Social Sciences,3 Units, Consent of instructor,"Terms offered: Spring 2016, Spring 2015, Spring 2014<br/>
Selected topics in quantitative/statistical methods of research in the social sciences and particularly in sociology. Possible topics include: analysis of qualitative/categorical data; loglinear models and latent-structure analysis; the analysis of cross-classified data having ordered and unordered categories; measure, models, and graphical displays in the analysis of cross-classified data; correspondence analysis, association analysis, and",0
STAT 272,Statistical Consulting,3 Units, Some course work in applied statistics and permission of instructor,"Terms offered: Spring 2018, Fall 2017, Spring 2017<br/>
To be taken concurrently with service as a consultant in the department's drop-in consulting service. Participants will work on problems arising in the service and will discuss general ways of handling such problems. There will be working sessions with researchers in substantive fields and occasional lectures on consulting.",0
STAT 278B,Statistics Research Seminar,1 - 4 Units,,"Terms offered: Spring 2018, Fall 2017, Spring 2017<br/>
Special topics, by means of lectures and informational conferences.",0
STAT 298,Directed Study for Graduate Students,1 - 12 Units, Consent of instructor,"Terms offered: Spring 2018, Fall 2017, Spring 2017<br/>
Special tutorial or seminar on selected topics.",0
STAT 299,Individual Study Leading to Higher Degrees,1 - 12 Units,,"Terms offered: Spring 2018, Fall 2017, Spring 2017<br/>
Individual study",0
STAT 375,Professional Preparation: Teaching of Probability and Statistics,2 - 4 Units, Graduate standing and appointment as a graduate student instructor,"Terms offered: Fall 2017, Fall 2016, Fall 2015<br/>
Discussion, problem review and development, guidance of laboratory classes, course development, supervised practice teaching.",0
STAT 601,Individual Study for Master's Candidates,1 - 8 Units,,"Terms offered: Summer 2018 8 Week Session, Spring 2018, Fall 2017<br/>
Individual study in consultation with the graduate adviser, intended to provide an opportunity for qualified students to prepare themselves for the master's comprehensive examinations. Units may not be used to meet either unit or residence requirements for a master's degree.",0
STAT 602,Individual Study for Doctoral Candidates,1 - 8 Units, One year of full-time graduate study and permission of the graduate adviser,"Terms offered: Spring 2018, Fall 2017, Spring 2017<br/>
Individual study in consultation with the graduate adviser, intended to provide an opportunity for qualified students to prepare themselves for certain examinations required of candidates for the Ph.D. degree.",0
