code,title,units,prereqs,offered,corrupt
UGBA 183,Introduction to Real Estate Finance,3 Units, 180,"Offered through: Business Administration<br/>
Terms offered: Spring 2018, Spring 2016, Spring 2015<br/>
Real estate debt and equity financing; mortgage market structure; effects of credit on demand; equity investment criteria; public policies in real estate finance and urban development.",0
UGBA 184,Urban and Real Estate Economics,3 Units, A background in microeconomics and basic calculus is preferable. Please contact the instructor if you are unsure about your preparation for this course,"Offered through: Business Administration<br/>
Terms offered: Spring 2016, Spring 2015, Spring 2014<br/>
This course examines how market forces influence the development of cities and the development and pricing of real estate assets. Topics include city formation; city size; land rent and land use; the operation of residential, commerical and industrial property markets; and the impacts of government policies, including the provision of public services, the imposition property taxes and fees, transportation",0
UGBA 190T,Special Topics in Innovation and Design,1 - 4 Units,,"Offered through: Business Administration<br/>
Terms offered: Summer 2018 First 6 Week Session, Spring 2018, Fall 2017<br/>
Advanced study in the fields of innovation and design that will address current and emerging issues. Topics will vary with each offering and will be announced at the beginning of each term.",0
UGBA 191C,Communication for Leaders,2 Units,,"Offered through: Business Administration<br/>
Terms offered: Fall 2016, Summer 2016 10 Week Session, Summer 2016 Second 6 Week Session<br/>
This course is a workshop in the fundamentals of public speaking skills in today's business environment. Each student will give speeches, coach, and debate each other, and take part in a variety of listening and other communication exercises. The course focuses on authenticity, persuasion, and advocacy.",0
UGBA 191I,Improvisational Leadership,3 Units,,"Offered through: Business Administration<br/>
Terms offered: Fall 2017, Fall 2016, Fall 2015<br/>
This class explores the broad principles of improvisation, a performing art form that has developed pedagogical methods to enhance individual spontaneity, listening and awareness, expressive skills, risk-taking, and one’s ability to make authentic social and emotional connections. The ultimate aim of the course is to help students develop an innovative and improvisational leadership mindset, sharpening",0
UGBA 191P,Leadership and Personal Development,3 Units,,"Offered through: Business Administration<br/>
Terms offered: Spring 2018, Spring 2017, Spring 2016<br/>
This course is highly interactive and challenges you to explore questions central to your own leadership journey. The ultimate aim of the class is to help you develop a lifelong leadership development practice, where continuous personal growth is valued and actively pursued.",0
UGBA 192A,Leading Nonprofit and Social Enterprises,3 Units, 101A or equivalent,"Offered through: Business Administration<br/>
Terms offered: Spring 2018, Spring 2017, Spring 2016<br/>
This course prepares students conceptually and practically to found, lead, and manage organizations in the nonprofit sector. The course focuses on mission and theory of change (strategy), role of the board in governance, managing and marketing to multiple constituencies, role of advocacy in meeting mission, leadership styles and managing organizational culture, resource development (philanthropy)",0
UGBA 192AC,Social Movements and Social Media,3 Units,,"Offered through: Business Administration<br/>
Terms offered: Fall 2017, Fall 2016<br/>
This course provides a survey of innovative social movements and their complex relationships to social media technologies. It will examine the evolution from pre-social-media to present-day mobilizing strategies and the interplay between explicitly policy- and advocacy-focused approaches and related efforts rooted in music, visual arts, popular culture and celebrities. The course will place into comparative relief",0
UGBA 192B,Strategic Philanthropy,2 Units,,"Offered through: Business Administration<br/>
Terms offered: Spring 2018, Spring 2017<br/>
This course teaches students the concepts and practices of effective philanthropy. It offers students the experience of studying relevant theories and frameworks for assessing potential grant recipients and a real-world grant making experience in which they complete a series of nonprofit organizational assessments and then make actual grants totaling $10,000 to a limited number of organizations. Students learn",0
UGBA 192N,Topics in Social Sector Leadership,1 - 5 Units,,"Offered through: Business Administration<br/>
Terms offered: Spring 2018, Fall 2017, Spring 2017<br/>
Advanced study in the field of social sector leadership that will address current and emerging issues. Topics will vary with each offering and will be announced at the beginning of each term.",0
UGBA 192P,Sustainable Business Consulting Projects,3 Units,,"Offered through: Business Administration<br/>
Terms offered: Fall 2016, Fall 2014, Fall 2012<br/>
Discuss the field of strategic corporate social responsibility (CSR) through a series of lectures, guest speakers, and projects. The course will examine best practices used by companies to engage in socially responsible business practices. It will provide students with a flavor of the complex dilemmas one can face in business in trying to do both ""good for society"" and ""well for shareholders.""",0
UGBA 192T,Topics in Corporate Social Responsibility,1 - 4 Units,,"Offered through: Business Administration<br/>
Terms offered: Summer 2018 First 6 Week Session, Spring 2018, Spring 2017<br/>
Advanced study in the field of corporate social responsibility that will address current and emerging issues. Topics will vary with each offering and will be announced at the beginning of each term.",0
UGBA 193B,Energy & Civilization,4 Units,,"Offered through: Business Administration<br/>
Terms offered: Fall 2017, Fall 2016<br/>
Energy is one of the main drivers of civilization. Today we are at the precipice of what many hope will be a major paradigm shift in energy production and use. Two transitions are needed. On the one hand, we must find ways to extend the benefits of our existing energy system to the impoverished people living in the developing world while continuing to provide these benefits to the people of the developed world.",0
UGBA 193I,Business Abroad,4 - 6 Units, To be determined by instructor depending on topic,"Offered through: Business Administration<br/>
Terms offered: Summer 2018 Second 6 Week Session, Summer 2017 Second 6 Week Session, Spring 2015<br/>
This course includes both formal learning in lectures, experiential learning, and action research through site visits abroad. Students and instructor will visit with international companies and/or organizations to learn about the business opportunities and challenges of operating in a specific country or region. Evaluation is based on student participation",0
UGBA 194,Undergraduate Colloquium on Business Topics,1 Unit,,"Offered through: Business Administration<br/>
Terms offered: Spring 2018, Fall 2017, Fall 2016<br/>
This is a speakers series course designed to give students insights from practitioners into complex issues facing American business leaders. Each week a guest speaker will discuss an issue related to a particular theme, ranging from corporate governance to the social responsibilities of business. Students will be challenged to synthesize, question, and extend those insights under the guidance of the",0
UGBA 195A,Entrepreneurship,3 Units,,"Offered through: Business Administration<br/>
Terms offered: Spring 2018, Spring 2017, Spring 2016<br/>
Do you have an idea for a new business, but want to learn how to more fully develop this idea? Would you like to receive funding for your business idea, but lack a framework to ask for capital? This course takes students through the new venture process using a business plan as the main deliverable. A well-written business plan sets key milestones and indicates the resources needed to achieve them",0
UGBA 195P,Entrepreneurship: How to Successfully start a New Business,3 Units,,"Offered through: Business Administration<br/>
Terms offered: Fall 2017, Fall 2016, Fall 2015<br/>
This course explores and examines key issues facing entrepreneurs and their businesses. It is intended to provide a broad spectrum of topics across many business disciplines including accounting, finance, marketing, organizational behavior, production/quality, technology, etc. Students will acquire a keen understanding of both the theoretical and real world tools used by today's entrepreneurial business",0
UGBA 195T,Topics in Entrepreneurship,1 - 3 Units,,"Offered through: Business Administration<br/>
Terms offered: Spring 2018, Fall 2017, Spring 2017<br/>
Courses of this kind will cover issues in entrepreneurship that either appeal to a specialized interest by type of firm being started (e.g., new ventures in computer software) or in the aspect of the entrepreneurial process being considered (e.g., new venture funding). The courses typically will be designed to take advantage of the access offered by the University and the locale to knowledgeable",0
UGBA 196,Special Topics in Business Administration,1 - 4 Units, Upper division standing,"Offered through: Business Administration<br/>
Terms offered: Spring 2018, Fall 2017, Summer 2017 Second 6 Week Session<br/>
Study in various fields of business administration. Topics will vary from year to year and will be announced at the beginning of each semester.",0
UGBA 198,Directed Study,1 - 4 Units, Consent of instructor,"Offered through: Business Administration<br/>
Terms offered: Spring 2016, Fall 2015, Spring 2015<br/>
Organized group study on topics selected by upper division students under the sponsorship and direction of a member of the Haas School of Business faculty.",0
