code,title,units,prereqs,offered,corrupt
UGIS 82,K-8 Teaching and Inquiry-Based Lesson Design in the Science and Mathematics Classroom,2 Units,,"Terms offered: Summer 2018 8 Week Session, Spring 2018, Fall 2017<br/>
This course surveys basic approaches to K-8 science and math teaching through modeling inquiry-based teaching and discussion. Topics include inquiry-based pedagogy, assessment techniques, lesson plan design and revision, and child development. Students are placed in science and math learning environments with upper elementary and middle school children to practice teaching. This seminar offers an opportunity to explore teaching",0
UGIS 98,Directed Group Study for Lower Division Students,1 - 4 Units,,"Terms offered: Spring 2018, Fall 2017, Spring 2017<br/>
Seminars for the group study of topics not covered by regularly scheduled courses. Topics may vary from semester to semester.",0
UGIS 110,Introduction to Disability Studies,3 Units,,"Terms offered: Fall 2017, Fall 2016, Fall 2015<br/>
This course focuses on the social and personal meaning of disability and chronic illness. We will explore definitions and conceptual models for the study of disability, the history of disabled people, bio-ethical perspectives, the depiction of disability in literature and the arts, public attitudes, and legal and social policies. The course will investigate the interaction of disability with social factors such as gender, sexual orientation, race",0
UGIS 112,Women and Disability,3 Units,,"Terms offered: Spring 2018, Spring 2017, Spring 2016<br/>
This course will explore the intersection of women's experience and disability issues, emphasizing the social and personal impact of disability and chronic illness on relationships, identity, employment, health, body image, sexuality, reproduction, motherhood, and aging. Through real stories of women's lives which reached the media in the last decade and before, students will move toward a dynamic understanding of the impact of a range of",0
UGIS 120,Introduction to Applied Language Studies,3 Units,,"Terms offered: Fall 2017, Spring 2017, Fall 2015<br/>
This course is an introduction to the study of language as applied to real world problems in specific situations in which people use and learn languages, e.g., language learning and teaching, language socialization, bilingualism and multilingualism, language policy and planning, computer-mediated communication, stylistics, translation, intercultural communication, language and symbolic power, political and commercial rhetoric. Fieldwork consists",0
UGIS C133,"Death, Dying, and Modern Medicine: Historical and Contemporary Perspectives",4 Units,,"Terms offered: Spring 2017, Spring 2016, Spring 2015, Fall 2013, Fall 2005, Fall 2002<br/>
This course will study the end of life--dying and death--from the perspective of medicine and history. It seeks to confront the humanist with the quotidian dilemmas of modern clinical practice and medicine's deep engagement with death more generally. It invites pre-med, pre-law, and public policy students to understand these matters in light of the historical and, more broadly, literary and artistic perspectives",0
UGIS 140,The Hand-Printed Book in Its Historical Context,2 Units,,"Terms offered: Spring 2018, Fall 2017, Spring 2017<br/>
The ""Hand-Printed Book"" is a studio course taught in the Bancroft press room. Using antique presses and 19th century type, each class produces by hand a rare first edition of a work from the Bancroft collections that has never been published before. As students learn how hand-produced books have been made in the west for the last 500 years, they are also taught about the history of the book, using examples from Bancroft's rare books",0
UGIS C155,Jewish Civilization: Modern Period,4 Units,,"Terms offered: Fall 2016, Spring 2015, Fall 2013, Fall 2012, Fall 2011<br/>
This is the fourth course in a four-course sequence in the history of Jewish culture and civilization. It explores the major themes in Jewish history from 1750 to the present, with special attention paid to the transformation of Jewish communal and individual identity in the modern world. Topics to be treated include the breakdown of traditional society, enlightenment and emancipation, assimilation, Hasidism, racial anti-Semitism",0
UGIS 156,Human Rights Interdisciplinary Minor Capstone Workshop,3 Units, History C187 or Letters and Science C140V,"Terms offered: Spring 2017, Spring 2016, Spring 2015<br/>
The HRI Capstone Workshop structures the process of turning research projects into conference papers in preparation for the HRI conference. The course allows students to tackle common research and writing problems together in a series of group advising sessions.",0
UGIS W157,"Experiential Learning: Context, Self-Reflection and Professional Development",3 Units,,"Terms offered: Summer 2018 10 Week Session, Summer 2017 10 Week Session, Summer 2016 10 Week Session<br/>
This course facilitates your learning and self-reflection about various types of organizational contexts, structures, and cultures and about the development of practical strategies to promote successful internship experiences. A series of audio-visual lectures, practical exercises, writing assignments, projects, and online group discussions will guide you through all stages of your internship",0
UGIS W158,Global Citizenship,3 Units,,"Terms offered: Summer 2018 10 Week Session, Summer 2017 10 Week Session, Summer 2016 10 Week Session<br/>
With this course, you will be able to add a new dimension to your internship experience: a reflection on global citizenship. You will be challenged to use your internship experience as an opportunity to critically explore cultural differences, modes of conduct and values. A series of audio-visual lectures, practical exercises, writing assignments, projects, and online group discussions will",0
UGIS 160A,Art,4 Units,,"Terms offered: Fall 2017, Fall 2013, Fall 2012<br/>
This course delves into various facets of the Arts in Washington, D.C., whether involving public arts through museums such as the Smithsonian, or performance venues such as theatres; art history and public issues involving arts sponsorship and presentation.",0
UGIS 162I,"Political Science: Lobbying, Money, and Influence in Washington",4 Units,,"Terms offered: Fall 2017, Spring 2017, Fall 2013<br/>
This course will be an intense examination of lobbying in Washington with particular attention given to the role of money and campaign finance in the operation of what has become a highly sophisticated and poorly understood network of advocacy and influence. The approach of the instructor is to provide a basic understanding of three different but interrelated knowledge sets: the Congress, political money, and lobbying by interest groups.",0
UGIS 162M,U.S. Foreign Policy in the Middle East,4 Units,,"Terms offered: Fall 2017, Spring 2016, Spring 2013<br/>
What are the United States' interests in the Middle East? Who and what determine those interests? And how are those interests pursued? This course addresses these questions in two parts. Students should leave this class with a strong understanding of the challenges that the U.S. faces in the Middle East, as well as an informed viewpoint regarding how well America is meeting those challenges.",0
UGIS 162N,American Political Journalism,4 Units,,"Terms offered: Fall 2017, Spring 2017, Fall 2013<br/>
This class will explore the relationships among politics, news media, and government. It will do so by focusing on particular news events in which the role of the media becomes an integral part of the story.",0
UGIS 162O,The Science of Politics: Campaigns and Elections,4 Units,,"Terms offered: Fall 2017, Spring 2017, Spring 2016<br/>
This class will teach you how to better understand the fundamental factors that drive elections in America and to learn some of the skills employed by political professionals. Many of your assignments will require you to apply the lessons of this class to real time events. Our goal in this class is to go beyond the spin and hyperbole of many election commentators and understand how voters decide and how strategists persuade.",0
UGIS 162V,Economics of Public Policy,4 Units,,"Terms offered: Fall 2017, Fall 2016<br/>
The purpose of this course is to give students a comprehensive overview of the major issues facing U.S. fiscal policy, with special emphasis on structural issues, such as the problems facing the major entitlement programs: social security, and Medicare/Medicaid. The course will emphasize the economic aspects of fiscal issues, but will also address their historical roots and political aspects.",0
UGIS 172A,The Communicator's Dilemma,4 Units,,"Terms offered: Prior to 2007<br/>
The course examines trends in a media landscape transformed by technology over the last three decades, from the post-Watergate era to the early soundings of the 2016 presidential campaign. The course will lean hard on guest speakers to give it topicality, urgency, and a sense of personal connection. We will also dissect media in its many forms to see if the old standards of objectivity have given way to a new model that verges on advocacy.",0
UGIS 172C,Politics and Poems: Writing Verse in D.C.,4 Units,,"Terms offered: Spring 2017<br/>
The course is space for writing and discussing poems in the nation's capital. The course is as much about reading poems as writing (and revising) them. Students will attend at least one live literary event as well as visit a museum or gallery to use the visual or plastic arts as a springboard for their poetry. Finally, students will acquire and hone the vocabulary necessary to offer constructive feedback on one another's work.",0
UGIS 187,Project-Based Instruction,4 Units, Education 131,"Terms offered: Spring 2018, Fall 2017, Spring 2017<br/>
Framed around the topic of sustainability, the course engages students from different math, science, and engineering majors in the process of applying the content knowledge from their discipline to build project-based curricula for presentation as part of a 45-hour field placement in a local high school classroom. Students develop pedagogical content knowledge and relate teaching theory to practice through readings, classroom activities, discussion",0
UGIS 188,Research Methods for Science and Mathematics K-12 Teachers,3 Units, ,"Terms offered: Spring 2018, Fall 2017, Spring 2017<br/>
Students undertake several in-depth research projects to develop methods for engaging in authentic research in the science or mathematics content area related to their major. Interactive lectures and labs are designed to meet the needs of future teachers by practicing specific techniques--including statistics, mathematical modeling, and scientific writing--needed to address scientific questions so that they may guide their future K-12 students",1
UGIS 189,Integrating Research Methods into K-12 Teaching in Mathematics and Science,1 or 3 Units, Concurrent internship in a research lab with the Cal Teach Summer Institute,"Terms offered: Summer 2018 8 Week Session, Summer 2017 8 Week Session, Summer 2016 8 Week Session<br/>
This course is designed to provide connections between research methods and science and math content learned in a research lab with teaching in the K-12 classroom. Hands-on inquiry-based science and math lessons are modeled and discussed. Students write research proposals, create posters demonstrating their research accomplishments, develop K-12 lesson plans that align with their research, and",0
UGIS 190,Independent Study - Research Methods,3 Units,,"Terms offered: Summer 2018 10 Week Session, Summer 2017 10 Week Session, Summer 2016 10 Week Session<br/>
Students enrolled will develop an independent research project under the supervision of a research mentor. Students will submit a formal research proposal and a final research paper, guided by the instructor.",0
UGIS 192A,Supervised Research: Humanities,1 - 4 Units,,"Terms offered: Spring 2018, Fall 2017, Spring 2017<br/>
Undergraduate Research Apprenticeship Program (URAP). Directed individual research on topics connected to faculty scholarship.",0
UGIS 192B,Supervised Research: Social Sciences,1 - 4 Units,,"Terms offered: Spring 2018, Fall 2017, Spring 2017<br/>
Undergraduate Research Apprenticeship Program (URAP). Directed individual research on topics connected to faculty scholarship.",0
UGIS 192C,Supervised Research: Biological Sciences,1 - 4 Units,,"Terms offered: Spring 2018, Fall 2017, Spring 2017<br/>
Undergraduate Research Apprenticeship Program (URAP). Directed individual research on topics connected to faculty scholarship.",0
UGIS 192D,Supervised Research: Physical Sciences,1 - 4 Units,,"Terms offered: Spring 2018, Fall 2017, Spring 2017<br/>
Undergraduate Research Apprenticeship Program (URAP). Directed individual research on topics connected to faculty scholarship.",0
UGIS 192E,Supervised Research: Interdisciplinary Studies,1 - 4 Units,,"Terms offered: Spring 2018, Fall 2017, Spring 2017<br/>
Undergraduate Research Apprenticeship Program (URAP). Directed individual research on topics connected to faculty scholarship.",0
UGIS C196A,UCDC Core Seminar,4 Units, C196B (must be taken concurrently),"Terms offered: Spring 2018, Fall 2017, Spring 2017, Fall 2016, Spring 2016, Fall 2015, Spring 2015, Spring 2014, Fall 2013, Spring 2013, Fall 2012, Spring 2012<br/>
This course is the UCDC letter-graded core seminar for 4 units that complements the P/NP credited internship course <a class=""bubblelink code"" href=""/search/?P=UGIS%20C196B"" onclick=""return showCourse(this, 'UGIS C196B');"" title=""UGIS C196B"">UGIS C196B</a>. Core seminars are designed to enhance the experience of and provide an intellectual framework for the student's internship. UCDC core seminars are taught in sections that cover various tracks such as the Congress",0
UGIS C196B,UCDC Internship,6.5 Units, C196A (must be taken concurrently),"Terms offered: Spring 2018, Fall 2017, Spring 2017, Fall 2016, Spring 2016, Fall 2015, Spring 2015, Spring 2014, Fall 2013, Spring 2013, Fall 2012, Spring 2012<br/>
This course provides a credited internship for all students enrolled in the UCDC and Cal in the Capital Programs. It must be taken in conjunction with the required academic core course C196A. C196B requires that students work 3-4 days per week as interns in settings selected to provide them with exposure to and experienc in government",0
UGIS C196W,Special Field Research,10.5 Units, Consent of instructor,"Terms offered: Spring 2018, Fall 2017, Spring 2017, Fall 2016, Spring 2016, Fall 2015, Spring 2015, Fall 2014, Spring 2014, Spring 2013<br/>
Students work in selected internship programs approved in advance by the faculty coordinator and for which written contracts have been established between the sponsoring organization and the student. Students will be expected to produce two progress reports for their faculty coordinator during the course of the internship, as well as a final paper for the course",0
UGIS 198,Directed Group Study for Upper Division Students,1 - 4 Units,,"Terms offered: Spring 2018, Fall 2017, Spring 2017<br/>
Seminars for group study of topics not covered by regularly scheduled courses. Topics may vary from semester to semester. Students must have completed 60 units to be eligible to enroll.",0
UGIS 303,Apprentice Teaching in Science and Mathematics,2 - 3 Units, Undergraduates may take the course with consent of instructor,"Terms offered: Spring 2018, Fall 2017, Spring 2017<br/>
The course is designed to support new science and mathematics teachers in earning a credential for teaching in California secondary schools. Students demonstrate that they have developed the skills to meet the state credentialing requirements by undertaking an inquiry project on their own teaching practice. Effective teaching methods for the science and mathematics classrooms are emphasized, including strategies for lesson planning, assessment",0
UGIS 304,Supervised Teaching in Mathematics and Science for Secondary Schools,5 Units," Completion of Science & Math Education minor, and admission to Cal Teach credential program","Terms offered: Spring 2018, Fall 2017, Spring 2017<br/>
Fieldwork for Cal Teach single subject math or science teaching credential.",0
